{
  "$schema": "providers.schema.json",
  "description": "AI 厂商元数据配置文件。修改后前后端自动生效，无需修改代码。",
  "version": "1.0.0",
  "updated": "2026-07-27",
  "providers": [
    {
      "id": "deepseek",
      "name": "DeepSeek",
      "env_prefix": "DEEPSEEK",
      "deeprag_provider_id": "deepseek",
      "deeprag_prefix": "DEEPSEEK",
      "default_base_url": "https://api.deepseek.com",
      "default_models": ["deepseek-v4-pro", "deepseek-v4-flash"]
    },
    {
      "id": "moonshot",
      "name": "Kimi",
      "env_prefix": "MOONSHOT",
      "deeprag_provider_id": "kimi",
      "deeprag_prefix": "KIMI",
      "default_base_url": "https://api.moonshot.cn/v1",
      "default_models": ["kimi-k3", "kimi-k2.6"]
    },
    {
      "id": "volcengine",
      "name": "Doubao",
      "env_prefix": "VOLCENGINE",
      "deeprag_provider_id": "doubao",
      "deeprag_prefix": "DOUBAO",
      "default_base_url": "https://ark.cn-beijing.volces.com/api/v3",
      "default_models": [
        "doubao-seed-2-1-pro-260628",
        "doubao-seed-2-0-lite-260428",
        "doubao-seed-1-8-251228"
      ]
    },
    {
      "id": "dashscope",
      "name": "Qwen",
      "env_prefix": "DASHSCOPE",
      "deeprag_provider_id": "qwen",
      "deeprag_prefix": "QWEN",
      "default_base_url": "https://dashscope.aliyuncs.com/compatible-mode/v1",
      "default_models": ["qwen-max", "qwen-plus", "qwen-turbo", "qwen-long"]
    },
    {
      "id": "minimax",
      "name": "MiniMax",
      "env_prefix": "MINIMAX",
      "deeprag_provider_id": "minimax",
      "deeprag_prefix": "MINIMAX",
      "default_base_url": "https://api.minimax.io/v1",
      "default_models": ["MiniMax-M2.7", "MiniMax-M2.5"]
    },
    {
      "id": "zhipuai",
      "name": "GLM",
      "env_prefix": "ZHIPUAI",
      "deeprag_provider_id": "glm",
      "deeprag_prefix": "GLM",
      "default_base_url": "https://open.bigmodel.cn/api/paas/v4",
      "default_models": ["glm-4.7", "glm-4.5", "glm-4.5-air"]
    },
    {
      "id": "siliconflow",
      "name": "硅基流动",
      "env_prefix": "SILICONFLOW",
      "deeprag_provider_id": "siliconflow",
      "deeprag_prefix": "SILICONFLOW",
      "default_base_url": "https://api.siliconflow.cn/v1",
      "default_models": [
        "Pro/Qwen/Qwen3.5-397B-A17B",
        "Pro/deepseek-ai/DeepSeek-V3.2",
        "deepseek-ai/DeepSeek-R1"
      ]
    }
  ]
}
